{
  "$schema": "https://json-schema.org/draft/2020-12/schema",
  "$id": "https://varwof.com/schemas/clc-d/containment-vectors.schema.json",
  "title": "CLC-D containment test vectors (capability-language-core-v1 §13)",
  "type": "array",
  "items": {
    "type": "object",
    "required": [
      "id",
      "kind",
      "spec_clause",
      "ext_revision",
      "conformance_class",
      "parent",
      "child",
      "expect",
      "derivation"
    ],
    "properties": {
      "id": {
        "type": "string",
        "pattern": "^[a-z][a-z0-9]*-[0-9]{3}$",
        "description": "Unique vector identifier (e.g. contain-001)"
      },
      "kind": {
        "type": "string",
        "const": "contain",
        "description": "All CLC-D vectors are containment vectors: parent vs child grant."
      },
      "spec_clause": {
        "type": "string",
        "description": "capability-language-core-v1 §13 section reference (e.g. 'CLC §13.4.3')"
      },
      "ext_revision": {
        "type": "string",
        "pattern": "^CLC-[0-9]+\\.[0-9]+$",
        "description": "CLC revision the containment vector declares (CLC-D is folded into the language revision stream, §13.11; the field name is retained from the retired EXT-00 draft). A runner whose declared revision is outside its compatible range MUST NOT short-circuit (the language revision gate CLC-A §12.1 applies to CLC-A inputs; CLC-D is declared per-implementation, §13)."
      },
      "conformance_class": {
        "type": "string",
        "const": "CLC-D"
      },
      "parent": {
        "type": "object",
        "required": ["id"],
        "description": "Parent grant GP under test: the boundary grant (principal's authorization).",
        "properties": {
          "id": {"type": "string"},
          "params": {},
          "constraints": {"type": "array", "items": {"type": "string"}}
        }
      },
      "child": {
        "type": "object",
        "required": ["id"],
        "description": "Child grant GC under test: the delegate's requested capability.",
        "properties": {
          "id": {"type": "string"},
          "params": {},
          "constraints": {"type": "array", "items": {"type": "string"}}
        }
      },
      "expect": {
        "type": "object",
        "required": ["contains"],
        "properties": {
          "contains": {
            "type": "boolean",
            "description": "Expected Contains(GP, GC)."
          },
          "reason": {
            "type": ["string", "null"],
            "description": "Expected resolved reason code on a false result (child_exceeds_parent / params_not_narrower / a CLC-A syntax code / different_namespace). Constraint differences never produce a reason: constraints are not part of the relation. null or omitted = not asserted; true results carry no reason."
          }
        }
      },
      "derivation": {
        "type": "string",
        "description": "One-line derivation for human review"
      }
    },
    "additionalProperties": false
  }
}