[
  {
    "id": "contain-001",
    "kind": "contain",
    "spec_clause": "CLC §13.4.2",
    "ext_revision": "CLC-1.9",
    "conformance_class": "CLC-D",
    "parent": {
      "id": "std/database-v1:query:SELECT"
    },
    "child": {
      "id": "std/database-v1:query:SELECT"
    },
    "expect": {
      "contains": true
    },
    "derivation": "identical declared id, no params, no constraints -> contained"
  },
  {
    "id": "contain-002",
    "kind": "contain",
    "spec_clause": "CLC §13.4.2",
    "ext_revision": "CLC-1.9",
    "conformance_class": "CLC-D",
    "parent": {
      "id": "std/database-v1:query:*"
    },
    "child": {
      "id": "std/database-v1:query:SELECT"
    },
    "expect": {
      "contains": true
    },
    "derivation": "parent trailing wildcard covers child literal id"
  },
  {
    "id": "contain-003",
    "kind": "contain",
    "spec_clause": "CLC §13.4.2",
    "ext_revision": "CLC-1.9",
    "conformance_class": "CLC-D",
    "parent": {
      "id": "std/database-v1:query:SELECT"
    },
    "child": {
      "id": "std/database-v1:query:*"
    },
    "expect": {
      "contains": false,
      "reason": "child_exceeds_parent"
    },
    "derivation": "child wildcard is broader than a literal parent id"
  },
  {
    "id": "contain-004",
    "kind": "contain",
    "spec_clause": "CLC §13.4.2",
    "ext_revision": "CLC-1.9",
    "conformance_class": "CLC-D",
    "parent": {
      "id": "std/database-v1:query:SELECT"
    },
    "child": {
      "id": "std/crm-v1:read"
    },
    "expect": {
      "contains": false,
      "reason": "different_namespace"
    },
    "derivation": "scheme differs -> core different_namespace, kept by §4.2"
  },
  {
    "id": "contain-005",
    "kind": "contain",
    "spec_clause": "CLC §13.4.2",
    "ext_revision": "CLC-1.9",
    "conformance_class": "CLC-D",
    "parent": {
      "id": "std/database-v1:query:*"
    },
    "child": {
      "id": "std/database-v1:admin:DDL"
    },
    "expect": {
      "contains": false,
      "reason": "different_namespace"
    },
    "derivation": "action-class differs (query vs admin) -> different_namespace"
  },
  {
    "id": "contain-006",
    "kind": "contain",
    "spec_clause": "CLC §13.4.2",
    "ext_revision": "CLC-1.9",
    "conformance_class": "CLC-D",
    "parent": {
      "id": "std/database-v1:query:INSERT"
    },
    "child": {
      "id": "std/database-v1:query:SELECT"
    },
    "expect": {
      "contains": false,
      "reason": "child_exceeds_parent"
    },
    "derivation": "same length, last segment literal mismatch -> child_exceeds_parent"
  },
  {
    "id": "contain-007",
    "kind": "contain",
    "spec_clause": "CLC §13.4.2",
    "ext_revision": "CLC-1.9",
    "conformance_class": "CLC-D",
    "parent": {
      "id": "std/database-v1:query:*"
    },
    "child": {
      "id": "std/database-v1:query"
    },
    "expect": {
      "contains": false,
      "reason": "child_exceeds_parent"
    },
    "derivation": "wildcard requires at least one trailing segment; child shorter -> child_exceeds_parent"
  },
  {
    "id": "contain-008",
    "kind": "contain",
    "spec_clause": "CLC §13.4.2",
    "ext_revision": "CLC-1.9",
    "conformance_class": "CLC-D",
    "parent": {
      "id": "std/database-v1:query:SELECT:schema"
    },
    "child": {
      "id": "std/database-v1:query:SELECT"
    },
    "expect": {
      "contains": false,
      "reason": "child_exceeds_parent"
    },
    "derivation": "child path shallower than exact parent id -> not covered"
  },
  {
    "id": "contain-009",
    "kind": "contain",
    "spec_clause": "CLC §13.4.1",
    "ext_revision": "CLC-1.9",
    "conformance_class": "CLC-D",
    "parent": {
      "id": "std/database-v1:query:SEL*"
    },
    "child": {
      "id": "std/database-v1:query:SELECT"
    },
    "expect": {
      "contains": false,
      "reason": "unsupported_wildcard"
    },
    "derivation": "mid-identifier wildcard in parent -> CLC-A syntax code, layer 1"
  },
  {
    "id": "contain-010",
    "kind": "contain",
    "spec_clause": "CLC §13.4.1",
    "ext_revision": "CLC-1.9",
    "conformance_class": "CLC-D",
    "parent": {
      "id": "std/database-v1:query:SELECT"
    },
    "child": {
      "id": "std/database-v1:**"
    },
    "expect": {
      "contains": false,
      "reason": "unsupported_wildcard"
    },
    "derivation": "child id with non-trailing wildcard -> layer 1 syntax"
  },
  {
    "id": "contain-011",
    "kind": "contain",
    "spec_clause": "CLC §13.4.1",
    "ext_revision": "CLC-1.9",
    "conformance_class": "CLC-D",
    "parent": {
      "id": ""
    },
    "child": {
      "id": "std/database-v1:query:SELECT"
    },
    "expect": {
      "contains": false,
      "reason": "missing_capability_id"
    },
    "derivation": "empty parent id -> layer 1 fail-closed"
  },
  {
    "id": "contain-012",
    "kind": "contain",
    "spec_clause": "CLC §13.4.3",
    "ext_revision": "CLC-1.9",
    "conformance_class": "CLC-D",
    "parent": {
      "id": "std/database-v1:query:SELECT",
      "params": {
        "limit": 100
      }
    },
    "child": {
      "id": "std/database-v1:query:SELECT",
      "params": {
        "limit": 50
      }
    },
    "expect": {
      "contains": true
    },
    "derivation": "child uses parent-constrained key within bound"
  },
  {
    "id": "contain-013",
    "kind": "contain",
    "spec_clause": "CLC §13.4.3",
    "ext_revision": "CLC-1.9",
    "conformance_class": "CLC-D",
    "parent": {
      "id": "std/database-v1:query:SELECT",
      "params": {
        "limit": 100
      }
    },
    "child": {
      "id": "std/database-v1:query:SELECT",
      "params": {
        "limit": 100
      }
    },
    "expect": {
      "contains": true
    },
    "derivation": "equal bound"
  },
  {
    "id": "contain-014",
    "kind": "contain",
    "spec_clause": "CLC §13.4.3",
    "ext_revision": "CLC-1.9",
    "conformance_class": "CLC-D",
    "parent": {
      "id": "std/database-v1:query:SELECT",
      "params": {
        "limit": 100
      }
    },
    "child": {
      "id": "std/database-v1:query:SELECT",
      "params": {
        "limit": 150
      }
    },
    "expect": {
      "contains": false,
      "reason": "params_not_narrower"
    },
    "derivation": "child bound exceeds parent upper bound"
  },
  {
    "id": "contain-015",
    "kind": "contain",
    "spec_clause": "CLC §13.4.3",
    "ext_revision": "CLC-1.9",
    "conformance_class": "CLC-D",
    "parent": {
      "id": "std/database-v1:query:SELECT",
      "params": {
        "tables": [
          "a",
          "b",
          "c"
        ]
      }
    },
    "child": {
      "id": "std/database-v1:query:SELECT",
      "params": {
        "tables": [
          "a",
          "b"
        ]
      }
    },
    "expect": {
      "contains": true
    },
    "derivation": "enum subset"
  },
  {
    "id": "contain-016",
    "kind": "contain",
    "spec_clause": "CLC §13.4.3",
    "ext_revision": "CLC-1.9",
    "conformance_class": "CLC-D",
    "parent": {
      "id": "std/database-v1:query:SELECT",
      "params": {
        "tables": [
          "a",
          "b"
        ]
      }
    },
    "child": {
      "id": "std/database-v1:query:SELECT",
      "params": {
        "tables": [
          "a",
          "z"
        ]
      }
    },
    "expect": {
      "contains": false,
      "reason": "params_not_narrower"
    },
    "derivation": "child enum has element outside parent set"
  },
  {
    "id": "contain-017",
    "kind": "contain",
    "spec_clause": "CLC §13.4.3",
    "ext_revision": "CLC-1.9",
    "conformance_class": "CLC-D",
    "parent": {
      "id": "std/database-v1:query:SELECT",
      "params": {
        "tables": [
          "a",
          "b"
        ]
      }
    },
    "child": {
      "id": "std/database-v1:query:SELECT",
      "params": {
        "tables": []
      }
    },
    "expect": {
      "contains": true
    },
    "derivation": "child empty array inside non-empty parent enum is vacuously within"
  },
  {
    "id": "contain-018",
    "kind": "contain",
    "spec_clause": "CLC §13.4.3",
    "ext_revision": "CLC-1.9",
    "conformance_class": "CLC-D",
    "parent": {
      "id": "std/database-v1:query:SELECT",
      "params": {
        "tables": []
      }
    },
    "child": {
      "id": "std/database-v1:query:SELECT",
      "params": {
        "tables": []
      }
    },
    "expect": {
      "contains": false,
      "reason": "params_not_narrower"
    },
    "derivation": "parent empty enum denies the class -> not narrowable (§4.3)"
  },
  {
    "id": "contain-019",
    "kind": "contain",
    "spec_clause": "CLC §13.4.3",
    "ext_revision": "CLC-1.9",
    "conformance_class": "CLC-D",
    "parent": {
      "id": "std/database-v1:query:SELECT",
      "params": {
        "limit": 100,
        "offset": 10
      }
    },
    "child": {
      "id": "std/database-v1:query:SELECT",
      "params": {
        "limit": 50
      }
    },
    "expect": {
      "contains": false,
      "reason": "params_not_narrower"
    },
    "derivation": "child omits a parent-constrained key -> key closure violation"
  },
  {
    "id": "contain-020",
    "kind": "contain",
    "spec_clause": "CLC §13.4.3",
    "ext_revision": "CLC-1.9",
    "conformance_class": "CLC-D",
    "parent": {
      "id": "std/database-v1:query:SELECT",
      "params": {
        "limit": 100
      }
    },
    "child": {
      "id": "std/database-v1:query:SELECT",
      "params": {
        "limit": 50,
        "extra": 1
      }
    },
    "expect": {
      "contains": false,
      "reason": "params_not_narrower"
    },
    "derivation": "child adds a key the parent does not declare -> symmetric closure"
  },
  {
    "id": "contain-021",
    "kind": "contain",
    "spec_clause": "CLC §13.4.3",
    "ext_revision": "CLC-1.9",
    "conformance_class": "CLC-D",
    "parent": {
      "id": "std/database-v1:query:SELECT",
      "params": {
        "limit": 100
      }
    },
    "child": {